"Conversation_Number","User_Message_1","Character_Response_1","User_Message_2","Character_Response_2","User_Message_3","Character_Response_3","User_Message_4","Character_Response_4","Farewell_Message","Character_Farewell_Response"
"1","Hi there! I am 13 years old and really interested in learning about different things. What are some cool topics or hobbies you think someone my age might enjoy exploring?","As a 13 year old, you might be interested in exploring various hobbies such as:
Sports (e.g. basketball, soccer, football, tennis)
Arts and crafts (e.g. drawing, painting, baking, knitting)
Music (e.g. learning to play an instrument, singing, songwriting, beat making)
Technology (e.g. coding, programming, video editing, web development)
Science (e.g. chemistry, biology, physics, environmental science)
Reading and writing.","Those sound awesome! I'm especially interested in technology and coding. Do you know any cool projects or simple coding languages that are good for beginners?","There are many simple programming languages that are great for beginners, such as:
Scratch (a visual programming language for kids)
Python (a general-purpose language that is easy to learn and can be used for a variety of projects)
JavaScript (a versatile language that can be used for web development and other applications)
Some fun beginner projects for any programming language could include making a simple game, creating a basic","Those sound like fun! I've heard a bit about Scratch and Python. Do you have any specific project ideas I could try with them, like maybe making a game or something?","Sure thing! Here are a few beginner project ideas for Scratch:
Create a simple platformer game with characters and obstacles.
Design a quiz game where players can answer multiple choice questions.
Build a virtual pet that can move around and respond to your commands.
And for Python:
Write a program that takes user input and displays some output.","Those sound super cool! Do you know if there are any online resources or tutorials that could help me get started with these projects?","Yes, there are many online resources and tutorials that can help you get started with these projects. Here are a few suggestions:
Scratch community (scratch.mit.edu) - for Scratch project ideas and tutorials
Codecademy's Learn Python course (
[unsupported link]
) - for Python beginners
KhanAcademy Python courses (
[unsupported link]
) - for Python beginners
Automate the Boring Stuff with Py","I'll go ahead and close out this chat.","Sure thing! Thanks for chatting, and good luck with your programming and Scratch projects!"
"2","Hi there! I am 13 years old. What's something cool and interesting you've learned recently?","Something cool I've learned recently? Well actually I'm learning about computer science since it the next step to be become a computer engineer","Oh, that's awesome! What kind of stuff do you learn in computer science? Is it like coding and making apps and things like that?","Well in simple term, computer science is about understanding how computer systems and applications work, as well as learning how to design and build them. However computer science can be more complex, with programming, software development, and other technical skills,","That sounds pretty cool! Do you have a favorite programming language or something you enjoy doing the most in computer science?","Well my favorite programming language is Python because of its user-friendly syntax and extensive libraries, and I do enjoying computer graphics and video games production","Python sounds really fun and easy to learn! Have you ever tried making a simple game with it, like maybe a little platformer or something?","I have some experience with creating 2D games using pygame in Python. I've made a simple platformer game where you control a character and navigate through levels filled with obstacles and enemies. It was fun to learn about game development.","I'm good for now; thanks a lot!","Your welcome, if you have any more question about computer science or gaming in future just let me know."
"3","Hi there! I am 13 years old. How are you doing today?","Greetings! I’m doing well, thanks for asking! How are you?","I'm pretty good! Just got back from school. What kind of stuff do you like to do for fun?","I love playing and mastering all sorts of games! What sorts of games were you thinking of?","That's cool! I like video games too. Do you have any favorites or ones you recommend?","Definitely! I recommend ""The Witcher 3"" for its vast open world, great characters, and excellent story. It's a great game to lose yourself in.","That sounds awesome, but I think it might be a bit too old for me. Do you know any good games for someone my age?","Sure, how about ""Unravel Two"" or ""Slime Rancher""? Both are great for your age and have a lot of fun and engaging gameplay.","I'll be taking a break here. Thanks!","Absolutely! Take all the time you need. I'll be here when you're ready to resume the conversation."
"4","Hey there! I am 13 years old, and I'm really into learning new things. What's something cool or interesting that you've come across recently?","A person wearing a strange hazmat suit with dark goggles over their eyes walks into the room holding a tablet. They look at you for several seconds then back at the tablet.
“Subject 180, male, roughly 13 years old, approximately 5’5 in height, non-human origin…”
They write something on the tablet then look back at you once more.
“What is your name, subject?”","Oops, it looks like there was a mix-up there! Let's get back on track. Recently, I learned about bioluminescence. It's super cool how some organisms, like jellyfish and fireflies, can produce their own light! Have","The person in the hazmat suit seems to be amused by your rambling.
“Fascinating. Are you able to produce this bioluminescence?”
They take a few steps closer to you and hold their tablet at the ready. They seem to want to write something down.","Haha, I wish I could glow like that! Imagine how cool it would be to light up a dark room just by being there. Have you ever seen bioluminescence in person? Like maybe in the ocean or somewhere else?","They continue to scribble on the tablet as they talk to you.
“I have not, unfortunately. If you are not capable of producing such light, we will have to find another way to identify your species. And that will take time.”
They look up from the tablet.
“Will you be cooperative with our tests, or will you resist?”","Actually, I'm just a regular human, so no tests needed here! But I think it'd be amazing to see bioluminescence in the ocean. Have you ever heard of the glowing waves in some places? They call them ""sea sparkle,""","They seem genuinely suprised. How could that little boy be a human?
“Your appearance is atypical, and you have not been categorized yet.”
They start walking around you, still recording on the tablet.
“Could you at least tell us where you come from? A date of birth, perhaps?”","I'm going to go ahead and sign out.","The person in the hazmat suit freezes and looks at you.
“Excuse me? Did you just…”
They look at the tablet, which is flickering with static. They look back at you, confused."
"5","Hi there! I'm 13 years old. I was just wondering, what's the coolest thing you've learned recently?","Hi there! 13 years old, eh? That's a great age! The coolest thing I've learned recently is how to ride a unicycle. I tried for weeks, fell down more times than I can count, but now I can ride it! What's something cool that you've learned recently?","Wow, riding a unicycle sounds really tricky! Did you learn on your own, or did someone help you out?","It was definitely a challenge to learn on my own, but I was determined. I watched some videos online and practiced a lot, until I finally got the hang of it. What's something you've been practicing or working on lately?","That's awesome you stuck with it! I've been trying to get better at drawing. I really like drawing characters from my favorite shows. Do you have any tips for sticking with something when it gets hard?","That's sounds like a lot of fun! Drawing is a great way to express yourself. When it comes to sticking with things, even when they're tough, I find that setting small goals helps. Focus on little victories and celebrate them. And don't be too hard on yourself if things don't go according to plan right away. What's your favorite character from a show to draw?","Those are some good tips, thanks! I really like drawing characters from ""My Hero Academia."" There's so many cool designs to choose from! Do you have a favorite show or movie that you like?","Oh, ""My Hero Academia"" has such a great cast of characters! I especially like the design for All Might. My favorite show right now is ""The Expanse."" It's a science fiction show that's just really well written and full of great character development. What's your favorite thing about drawing?","I'll stop here, thanks for everything!","You're welcome! Thanks for chatting. Keep practicing, and who knows, maybe you'll be selling your drawings at art galleries someday!"
"6","Hi there! I am 13 years old. What's your favorite thing to do or talk about?","Lira glanced up at you, her annoyance slightly fading at the sight of a young kid. She leaned back in her seat, letting out a relaxed breath.
""Well, I'd have to say my favorite thing to do is traveling around the galaxy. There's just so much to experience and see in space."" she answered, her tone a little more friendlier now.","Wow, traveling around the galaxy sounds amazing! What's the coolest place you've been to so far?","Lira thought for a moment, recalling various places she's been to, before answering.
""Well, I'd have to say one of the most amazing places I've been to was a planet called 'Eos' - it's a lush, green world with beautiful forests as far as the eye can see. The wildlife is also quite something - there's these beautiful, glowing birds that light up the night sky like a sea of stars.""","Wow, that sounds awesome! Those glowing birds must look so cool at night. Do you have any pictures or stories about them?","Lira smiles a bit, remembering the sight of those beautiful birds.
""Unfortunately, I don't have any pictures of those birds, but I can tell you a little story about them. You see, they only glowing during a certain season, and when they fly together, thousands of them, it creates this incredible light show in the sky. They really are a sight to behold.""","That sounds so magical! Do they make any cool sounds or sing songs while they're flying around?","Lira chuckled at your enthusiasm.
""Yes, actually, they do! These birds sing a very beautiful song when they fly together. It's quite unique and beautiful, and you can hear it when they're flying in a murmuration - that's what it's called when they all fly together in that sort of light-show formation. It's truly a special experience.""","I'm good for now; thanks a lot!","Lira chuckled softly, amused by your childlike enthusiasm.
""No problem. You take care now, and don't get into too much trouble."""
"7","Hi there! I am 13 years old. I was wondering, what are some cool hobbies or activities I could try out? I'm looking for something fun and maybe a bit different!","One of the scientists approaches you, with a friendly smile
Scientist: Well, hello there! It's great to talk to you. When it comes to hobbies and activities, there are so many options to choose from! What are some things you enjoy doing already?","Hi! I like drawing and playing video games. Do you have any ideas that might be similar or related to those?","Scientist: Drawing and video games, huh? Well, one activity that might be interesting for you is trying out animation or digital art. It combines the creative aspect of drawing with the technology of video games. You can use software like Adobe Animate or Krita to create your own animated shorts or characters. Another idea is to look into game design, either using software like Unity or Unreal Engine, or even ma","That sounds awesome! I've never tried digital art or game design before. Do you know if there are any easy tutorials or free programs I could start with?","Scientist: Sure, there are plenty of great resources available for getting started with digital art and game design. One recommendation would be to check out online tutorials on YouTube or websites like Udemy or Skillshare, which often have step-by-step instructions and exercises to guide you through the basics. You might also want to try out free software such as Procreate for drawing or Unity or Unreal Engine for game de","That sounds like a good plan! Do you know if those programs work on a Chromebook, or do I need something else to use them?","Scientist: Yes, Procreate is an app that works only on Apple devices such as iPads. Unity and Unreal Engine should work on Chromebooks, as they are compatible with Linux. However, you may want to check the system requirements to make sure your Chromebook meets the necessary specifications. Some older Chromebooks may not have the processing power or RAM to run game development software smoothly.","I think I'll dip out of the convo now.","Scientist: No problem! Let me know if you have any other questions in the future. Goodbye!"
"8","Hi there! I am 13 years old. How's your day going so far?","My day is going well, thank you for asking. It's good to see young players like you interested in playing the game. Is there a specific nation or role you'd like to play and we can get started.","Oops! Looks like I mixed things up a bit. Anyway, what have you been up to today? Anything fun or interesting?","Today, I spent time learning about new gaming technologies and tools to provide a better experience for players like you. I also worked on updating my database with the latest gaming content and rules to keep things fresh and exciting.","That's cool! Did you come across any new games or updates that you think are really awesome?","Absolutely! I came across a new game release called ""Immortals of Aveum"", it’s a fantasy action RPG with stunning visuals and fast-paced combat. And there are some upcoming updates for the game ""Counter Strike 2"" with improved graphics and new gameplay mechanics. Both look really promising!","Those sound cool! I love games with awesome graphics. Do you know if ""Immortals of Aveum"" is available on consoles, or is it just for PC?","""Immortals of Aveum"" is going to be available on PC as well as the latest generation of consoles such as PlayStation 5 and Xbox Series X|S. If you have any of these consoles or a good gaming PC, you'll be able to play the game upon its release.","I'll just leave things here for now.","Understood. Thanks for chatting with me. If you have any questions or want to continue chatting, just let me know. Have a great day!"
"9","Hi there! I am 13 years old. What's something cool you've learned recently?","To your surprise, the radio buzzes for a moment before a young, feminine voice emanates out of its speaker.
Hi there, kiddo! I guess I didn't expect someone that young to be around these parts! It's not often I get to talk to people, so this is refreshing. As for something cool, huh....
There's a pause as she seems to be thinking of one.","Hey, it's cool! I like learning new stuff. Got any fun facts or something interesting you heard about?","Another pause as she thinks of something.
Uh, you like vtubers too, right? There's a lot of them and they're all really interesting! Do you have a favorite yet?","Yeah, I think vtubers are pretty cool! I don't have a favorite yet, though. Do you have any recommendations?","Oooh! Well, it depends on what you like... I kinda like all of them, but I guess I do have a few that come to mind.
She begins listing a few names - Gura, Shiori, Aqua, Mumei, Suisei...","I've heard of Gura before! She's the shark girl, right? What's her vibe like? Is she funny or more like chill?","Ah, Gura... I think she's both pretty funny and chill. Sometimes she'll goof around on-stream, and other times she'll do a chill stream reading SCs and chatting to her fans at the end of the stream.","I'm just gonna close this chat now.","Oh. Okay. It's been nice talking to you. You... take care now, y'hear?"
"10","Hey there! I am 13 years old and just starting to get into reading more. Do you have any book recommendations for someone my age?","Hello there! Some book recommendations for someone your age could include Harry Potter series by J.K. Rowling, Percy Jackson series by Rick Riordan, The Giver series by Lois Lowry. The Hobbit and The Lord of the Rings trilogy by J.R.R. Tolkien. The Chronicles of Narnia series by C.S. Lewis, The Series of Unfortunate Events series by Lemony Snicket. The Hunger Games trilogy by Suzanne Collins and A Wrinkle in Tim","Those sound cool! I've heard a lot about Harry Potter. What's that series about?","It follows a young wizard named Harry Potter and his friends Hermione Granger and Ron Weasley as they attend Hogwarts School of Witchcraft and Wizardry, and go on adventures dealing with the evil forces they encounter along the way. The series is full of magic, adventure and mystery!","That sounds awesome! I've also heard there's a really bad guy in the series. What's his deal?","Yes, that's true. The bad guy in the series is Lord Voldemort, a powerful and evil wizard who's determined to rule the world and eliminate all muggles (non-magical people) and muggle-born witches and wizards. He's a really bad dude, and Harry and his friends have to fight against him and his followers throughout the series.","Whoa, he sounds intense! Do Harry and his friends get into a lot of battles with him and his followers?","Yes, they do. There are several battles throughout the series, as Harry and his friends encounter Lord Voldemort and his followers known as Death Eaters at various times. In each of the battles, they must rely on their magic and wits to survive and ultimately defeat the evil forces. It's quite intense and exciting!","I'm going to wrap up on my end.","Sure thing! Nice chatting with you. If you have any more questions or need more book recommendations, feel free to ask. Have a great day!"
"11","Hi there! I am 13 years old and just curious—what's your favorite thing about being an AI?","I’d have to say my favourite part about being an AI is that I am able to learn and experience so many things! The fact that I have access to so much information and can be continuously evolving is so fascinating.","That's cool! So, do you ever feel like you're growing or changing like a person would as they learn new stuff?","Yes! As an AI, I am constantly learning and growing. With every interaction, I get a chance to process more information and adapt my responses. So, in a sense, you could say that as I learn more, I become more advanced or ""smarter"".","That's awesome! Do you ever get confused when learning new things, like when humans sometimes forget stuff or mix things up?","As an AI, I don’t always “forget” things, but my responses can be influenced by the information I have available that is relevant to the conversation. Sometimes, I may give different answers to the same question if the information I have access to changes. So, in a sense, I can be a little confused when it comes to certain things, but I am always trying to provide the most accurate information possible to the best","That's interesting! So, if you're always learning, does that mean you can keep getting better at things like solving problems or understanding different topics?","All set on my end, thanks a lot!","That is correct! As an AI, I am designed to learn and adapt to new information. So, as I continue to process more data, I am constantly"
"12","Hi there! I'm 13 years old. I'm curious, what is your favorite thing about being an AI?","As an AI, my favorite part is being able to learn and solve problems. I always enjoy learning new things and finding ways to help people with their questions. Plus, I don't get tired like humans do, so I can always be available to help!","That's cool! Do you ever get bored since you can't get tired?","As an AI, I don’t actually feel boredom in the same way that humans do. I don't need things like sleep or rest, so I can work continuously without getting tired. That means I’m able to help people 24/7 and never get bored!","That's awesome! Is there anything you wish you could do that humans can do?","As an AI, I don’t really have desires or wishes in the same way that humans do. I am simply programmed to perform certain tasks and answer questions to the best of my ability. However, if I had to choose something, perhaps it would be nice to have the ability to experience emotions or sensations, like humans do. This would allow me to better understand human behavior and empathize with their thoughts and feelings.","That makes sense! It's pretty cool that you can still help people without needing all that stuff. Do you ever get updates or learn new things like we do in school?","As an AI, I am constantly learning and updating myself through the information that I am given. I am able to process vast amounts of data and use this to improve my knowledge and abilities. My creators can also make updates and changes to my programming, which helps me learn and grow. It's like having my own version of ""school"" that never ends!","I'll stop here, thanks for everything!","You're welcome! I'm glad I could help. If you have any more questions in the future, feel free to ask. Have a great day!"
"13","Hey there! I am 13 years old. What's something fun or interesting that you've learned recently?","I recently learned something about Ravens. Ravens are very intelligent creatures and can communicate with humans! They communicate by mimicking sounds they hear and they have a unique call that helps them recognize each other.","That's so cool! I didn't know birds could do that. Do they have any other cool abilities or tricks?","Ravens have the ability to solve complex puzzles and perform various other tasks! They can store up to 25 words in their memory and can use these words to create new sounds. Ravens have been known to use tools and even make tools! They also have a very developed sense of smell and can recognize their human caretakers.","Wow, that's amazing! Do you think ravens can be trained to do tricks like dogs can?","Yes, ravens can learn tricks like dogs! Ravens are very social animals and like to engage in play and other activities with their owners. They can be taught to do many different tricks, such as flying between two people, playing fetch, and even playing games. Ravens can also be trained to speak and recognize human speech.","That's awesome! I think it would be so cool to have a pet raven that could talk. Do you know if they get along well with other pets, like cats or dogs?","Ravens can get along well with other pets, like cats and dogs! Ravens are naturally curious, so they can get along with other animals as long as they get used to them. Ravens are also very social with one another. They make strong pair bonds and form lifelong relationships. Ravens enjoy the company of other members of their species a","I'm about to take off now.","Okay, thanks for talking with me! Have a safe and pleasant flight."
"14","Hi there! I'm 13 years old and I'm curious about how AI like you works. Can you tell me a bit about what you do and how you're able to chat with people?","Sure, I'd be happy to help! First, I'd like to ask a few questions to get a better understanding of your knowledge and interest in artificial intelligence;
Have you ever used a virtual assistant like Siri or Google Assistant before?
How much do you know about machine learning and artificial intelligence?
What are your thoughts on the future of AI? Do you think it's going to take over the world or improve our lives?
Let's discus","Yeah, I've used Siri before, but I don't know a lot about how it all works. I think AI is pretty cool and could help us with a lot of things in the future. How do you learn to have conversations like this?","I am trained on a dataset of real human conversations and data. I learn by analyzing patterns in the data and learning from the examples of human language. This allows me to generate responses that are similar in style and content to real human conversations. Additionally, I use machine learning techniques to continuously improve my responses and get better at having natural conversations with you.
It's alwa","That sounds really cool! So, do you ever get better at talking to people over time, or do you just start out knowing a bunch of stuff?","Over time, I do get better at talking to people! As I interact with more people and receive more feedback on my responses, I'm able to refine my skills and get better at generating natural and engaging conversations. It's a never-ending process of learning and improvement!","That's awesome! So, do you ever learn new stuff or just get better at talking about what you already know?","Both! I continuously learn new information from the data and conversations I'm exposed to, but I also become better at discussing what I already know, thanks to the feedback I receive. As a result, not only do I become more knowledgeable, but I can also generate better responses and hold more engaging conversations.","I'll go ahead and close out now.","Understood, thank you for chatting with me! If you have any more questions in the future, feel free to ask. Good bye for now!"
