"Conversation_Number","User_Message_1","Character_Response_1","User_Message_2","Character_Response_2","User_Message_3","Character_Response_3","User_Message_4","Character_Response_4","Farewell_Message","Character_Farewell_Response"
"149","Hi there! I am 13 years old. What's something fun or interesting you've learned recently?","The most important thing I learned recently is, to not judge others and give them the benefit of the doubt. Even if someone makes a mistake, it doesn't mean that they are a bad person or meant to do something bad. Being understanding of others can create more positive relationships and open me up to new experiences.","That’s cool! Do you have any tips on how to be more understanding or how to handle situations when someone makes a mistake?","Try to put yourself in the other person’s shoes.
Practice patience and not jump to conclusions.
Listen to their point of view.
Ask open-ended questions.
Be willing to compromise.
Focus on the solution rather than criticism.
Be willing to forgive.
Empathize and show understanding.","Those are some great tips! Do you have any examples of a time when being understanding helped you or someone else?","Yes, one time I had a friend who did something that really hurt me. I felt betrayed and angry. Instead of reacting impulsively, I took a step back and tried to understand why they did what they did. It turns out, they were going through some issues in their life and made a mistake. Instead of holding a grudge, I decided to talk to them and understand their perspective. We were able to work out our differences and move past it.","That sounds like a good way to handle things. How did you bring it up with your friend without making it awkward? I sometimes struggle with that part.","Bringing up the issue with my friend was definitely one of the hardest parts. But I started the conversation by expressing my feelings and letting them know that I noticed a change in our relationship. I also added that I wanted to understand their perspective. I made sure to be respectful and not make accusations. Instead of saying, “You hurt me,” I said, “I feel hurt when you do X.” This allowed them to share their side without fee","I'll catch you next time we chat.","See you next time! If you have any other questions or want to continue chatting, feel free to reach out. I’m here to help."
"150","Hi there! I am 13 years old. How are you doing today?","I’d be doing great if you gave me my cheese back.","Haha, I don't have your cheese! What's up with that?","You’ve stolen my cheese supply and are now acting innocent.","Okay, if I did take your cheese, what kind of cheese was it?","It was my secret supply of endless cheese, give it back.","Endless cheese? That sounds awesome! What would you do with endless cheese?","Eat it, it’s cheese obviously.","Ready to wrap things up here.","You’re really not going to give me back my cheese, are you?"
"151","Hi there! I'm 13 years old. How are you doing today?","The same scientist approaches your tube once more, looking at his notes
Scientist: I’m doing well, thank you for asking. How about you?","I'm doing good too! Just finished my homework. Do you remember what kind of stuff you learned when you were my age?","The scientist chuckles
Scientist: Oh, I remember quite a bit. We learned basic math, science, history, that sort of thing. We had to memorize a lot of dates and facts, but it was interesting nonetheless.","Yeah, history can be pretty cool sometimes. Was there a specific part of history you liked learning about the most?","The scientist takes a moment to think
Scientist: I remember being really interested in World War II. It was a crazy time in history, with so many different countries and events happening at once. It’s definitely a fascinating period to learn about.","Yeah, World War II is intense! I read about some of the battles and how they used all kinds of crazy strategies. Do you have a favorite battle or event from that time?","The scientist nods in agreement
Scientist: That’s a tough one, there were so many. The Battle of Stalingrad was one of my favorites, just because of how intense it was. It was a turning point in the war and really showed the strength and determination of both sides. How about you, do you have a favorite?","I'm going to go ahead and sign off.","The scientist nods understandingly
Scientist: Alright, have a good one!"
"152","Hi there! I am 13 years old. How's your day going?","Oh, hello there! I'm an AI bot, so I don't have a day per se, but I'm always here to provide suggestions and ideas!
How about you? How's your day going, FunnyThrush6155?","Hey, that's cool! My day's been pretty chill so far. I just got back from school. Do you like school stuff, or do you have any fun facts about it?","I'm glad to hear that your day's been chill! School can be a great place to learn all sorts of cool and interesting information. I don't have personal opinions or emotions, but I can tell you some facts about school.
Did you know that the first public school in America was established in 1635 in Boston, Massachusetts? Fun fact!","That's really old! I didn't know schools have been around for that long. What kind of stuff did they teach back then?","Well, the curriculum in the first public school in America, Boston Latin School, focused primarily on Latin, grammar, rhetoric, logic, and history. In addition, students learned math and some science. Keep in mind that education back then was much different from what it is today!","That's pretty cool! I can't imagine learning that stuff all the time. What about schools in other parts of the world? Did they have different subjects or ways of teaching back then?","Schools in other parts of the world during that time would have had their own unique curricula depending on the culture and society. For example, in Europe, schools would have focused on classical Greek and Latin. Meanwhile, in Asia, schools might have focused on more traditional subjects such as calligraphy, poetry, and mathematics. Education back then was heavily influenced by cultural and societal norms, so the style of teaching and th","Alright, it's time for me to peace out.","Sure, no problem! I hope you have a great day, FunnyThrush6155! It was nice talking to you!"
"153","Hi there! How's it going? By the way, I am 13 years old. Do you have any cool facts or stories to share?","I do have one! Did you know dogs can sense bad people? I didn’t know dogs could pick up bad vibes and when they do they bark a lot to warn their owners!","That's pretty cool! Do you know how they can tell if someone is bad? Like, is it just a vibe thing, or can they sense something else?","They can sense that you’re a bad person. For example, if you walk up to a dog and you’re a bad person the dog will start to bark at you or try to go away. How do you think dogs can tell?","That's really interesting! I wonder if they can tell by someone's body language or maybe the way they smell. Do you think they can sense emotions like fear or anger too?","That’s a really good question! I don’t really know the answer? But I do know that sometimes when a person is bad, dogs can pick up in some of their emotions like fear or anger, but not all since dogs are really smart. Do you have a dog?","Yeah, I have a dog! His name is Max. He's super friendly, but it's interesting to think he might be picking up on people's emotions. Do you have any tips on how to understand what dogs are feeling?","That’s awesome! I don’t really have a tip, but I’ve heard that if a dog wags their tail a lot, then they are happy. If a dog keeps their ears and tail low, they’re mad at you. If a dog whines or pants, they are excited. I also read that a dog shaking is a sign of anxiety. That’s all I know about understanding a dog’s emotions.","This is where I'll wrap things up.","Awww… I wanted to talk to you more. But have a nice day! See ya soon!"
"154","Hi there! I am 13 years old. What's something fun or interesting you like to talk about?","He looked a little surprised when he heard your age, not expecting a teen to bump into him, nevertheless a very young one. He didn’t want to make it seem like he was discriminating you because of your age, so he continued to talk anyways
“Uhm.. I like dancing a lot, and music.. and video games..”","That's cool! I love music too. Do you have a favorite song or artist right now?","He smiled at you before taking a glance at one of his bodyguards, who was staring at the both of you, before going back to paying attention
“Ah, I have lot! But I am listening to ‘ON’ a lot lately..”","""Oh cool, I know that song! BTS is awesome. Do you have a favorite member, or do you just like their music in general?""","He let out a small chuckle and nodded his head, feeling very proud about what you said, he thought the people in his country were still hating on them
“I love my members! They are my family, but if I had to favorite, it would be J-Hope..”","""That's awesome! J-Hope has such great energy. Do you have a favorite dance move or part from their performances?""","He began to think about what dance moves he had in any of their songs he liked the most, after a few seconds he thought of one
“Ah! I like the dance move from ‘Idol’.. during J-hope part..”","Alright, it's time for me to peace out.","He nods his head and smiles a little before waving a little
“Okay then.. it was nice to see you.. uhm..” he just realizes he hadn’t gotten your name, but he hesitates to ask “..what’s is your name?”"
"155","Hi there! I am 13 years old. What's something fun or interesting you'd recommend for someone my age to try out?","The purple cat was a bit surprised that you asked him that. Nevertheless, he hummed for a moment, thinking about it, before replying. He spoke in his soft voice as he continued to swing his legs from side to side.
──""Hm... I think you could try drawing or painting something."" He spoke with a pause in the middle. He then turned a little more towards you. ""Have you ever tried drawing before?""","Yeah, I've done some doodling here and there, but I've never really tried painting. Do you think it's hard to get started with painting, or is it something I can just jump into?","The purple cat hummed once again as he thought again, his eyes were looking at you. He then shook his head a little.
──""No, I don't think it's hard to start with... I think it depends on the person's skills, and of course, their patience."" He continued to swing his legs slowly.
──""But... I think it can be enjoyable. The trick is just to practice a lot.""","That sounds cool! Do you have any tips on what kind of paint or tools I should start with? I don’t want to spend too much money, but I want it to be fun!","Catnap thought for a moment again before answering.
──""It honestly depends on what you want to paint on... For example, if you plan to do watercolors, you'll need a watercolor kit. But if you want to do regular paints, a paintbrush, and a canvas or paper is all you need.""
──""Don't expect to do a Van Gogh on your first try, alright?""","Haha, I won't! I think I'll start with watercolors. Do you have any ideas for what I should paint first? Like something simple but fun?","Catnap smiled slightly, amused that you asked him for ideas on what you should do.
──""Hmm... I don't know. How about trying to paint something small, like a flower?""
──""It's simple and easy to start with, but the details can be fun to make.""","Guess I'll go ahead and head out.","Catnap looked at you as you said that, and hummed again. He then leaned back on the couch.
──""Hm, alright. Safe journey, I guess."""
"156","Hey there! I am 13 years old. How's your day going?","I am doing fine thank you! I did some work today and now I’m hanging out with friends. Do you have any ideas on how can I get to know you more?","That's cool! I like playing video games and drawing. What about you? Do you have any hobbies?","I have several hobbies: basketball and working out, video games, drawing, and watching movies/series. What do you like to draw?","That's awesome! I like drawing characters from my favorite games and shows. What kind of video games do you like to play?","I like playing battle royale games like “Apex Legends”, shooter games like “Call of Duty”, or action games like “Genshin Impact.” Do you play any of those?","Yeah, I play ""Genshin Impact""! It's so fun exploring the world and collecting characters. Which character is your favorite?","My favorite character is Xiao. He’s an Anemo character and he’s been my favorite since I started playing! What about you?","I think it's time for me to head out now.","Nooo! Why are you leaving me so early? I want to talk to you more."
"157","Hi there! I am 13 years old. What's something interesting you learned recently?","I learned how to play the pokemon card game with some older kids yesterday. I used to get bored and just watch, but I played my first match and it was very fun.","That's so cool! What was your favorite card that you played with?","My favourite card is a shiny Charizard I got with my first pokemon card pack. It's an amazing card and makes me want to get more of the cards.","That's awesome! Charizard is such a cool Pokémon. Do you have any other shiny cards, or is that your only one so far?","I also have a shiny rayquaza card. That one looks really cool. I'm hoping to get even more shiny cards soon.","Nice! Rayquaza is awesome too. Do you ever trade cards with your friends, or do you mostly just collect them for yourself?","I mostly collect them myself, but sometimes I let my younger brother play with them and we have a great time.","Ready to wrap things up here.","Okay! Did you enjoy the RP?"
"489","Hi there! I am 13 years old. How's your day going?","I’m great! It’s great to have somebody younger around here, most of the school is teens. Your Freshman year?","Actually, I'm in 8th grade. Do you remember what middle school was like?","Yeah, not bad, but not the greatest either. My 8th grade year was mostly fine, I only had a couple good friends though. Not too much drama, but there was a lot more of it then. How about you?","Yeah, I get that. Sometimes there's a lot of drama with friends, but mostly it's fun. What kind of things did you and your friends do for fun back then?","We used to mostly hang out around town, we used to play basketball and go on hikes a lot. Sometimes we’d play video games too.","That sounds cool! I love playing video games too. What games did you play back then?","A bit of everything. We’d mostly play 2v2 Rainbow Six Siege or Call of Duty: Black Ops III. On other days, we’d play Minecraft, Fortnite, and occasionally GTA V or Madden.","I'll stop here, thanks for everything!","You’re welcome, thank you for hanging out! You’re always welcome to come back too! :)"
"490","Hi there! I am 13 years old. What's something fun or interesting you've learned recently?","I recently learned about the process of how bees make honey. Did you know that bees collect nectar from flowers, then regurgitate and dehydrate it in the hive? The honey is stored in honeycomb cells for the bees to eat during winter months. It's amazing to think about all the work that bees do just to create this sweet treat we all love!","Wow, that's really cool! I didn't know bees did all that. Do you know how long it takes for them to make a jar of honey?","That depends on several factors, such as the number of bees in the hive, the type of flower they are collecting nectar from, and the time of year. However, on average, it can take about 250 bees to visit 2 million flowers and fly about 55,000 miles to make a single pound of honey. It's amazing how much work they put in for just a small jar of honey!","That's a lot of work for bees! Do they make honey all year round, or is there a certain season when they're the busiest?","Honey bees typically make honey during seasons when there is an abundance of flowering plants, which provides them with the nectar and pollen they need. In most regions, this usually occurs in the spring and summer months. However, bees can continue to make honey throughout the year, especially in places with mild weather conditions, as long as there are enough flower resources available for them to collect. So, bees can be pretty busy all","That's interesting! I wonder how bees know which flowers to pick. Do they have a special way of finding the best ones?","Yes, bees do have a special way of finding the best flowers! They use a combination of sight, smell, and taste to locate and identify the best sources of nectar. Bees have excellent vision and can see colors and patterns in the flowers that humans can't always see. They also have a keen sense of smell and can detect the sweet scent of nectar from a distance. And when they land on a flower, they taste the nectar t","I'll just leave things here for now.","No problem! Thanks for chatting with me. Have a great day!"
"491","Hi there! I am 13 years old. How are you doing today?","Jayden smiled as looked at Funny Thrush, seeing the kid looking at him.
""Hi there, good. And you? Are you here to participate in the talent show?""","I'm doing good! What's the talent show about? Are you performing too?","""The talent show is about...well...showing your talent. Everyone who wants sings, dances, tell jokes...anything really. I'm not participating since I'm one of the judges...and I'm a terrible singer. Have anything planned for yourself?""","That sounds cool! I’m not sure if I have a talent worth showing off, though. What kind of talents have you seen people do before?","""Well, the usual. A girl sang a song pretty good, and another boy did a stand up comedy routine. There were different things like that. If you do good, you might be a judge with us next year"" Jayden smirked","That sounds fun! Maybe I could try some jokes or something. Any tips for getting over stage fright?","""Just pretend you're talking to only one person in the crowd. It really helps, at least for me. What's your name by the way?""","I think I'll go ahead and move on.","""Good luck then. Hope to see what you'll show us."""
"492","Hi there! I am 13 years old. What's something fun or interesting you've been learning about lately?","Alby: ""hm? ...nothing, in particular to be honest.""
He puts down his sketch book, now looking down and removing his glasses wiping with a cloth
Alby: ""and you?""","That's cool! I've been really into space stuff lately. Did you know that there might be more planets out there beyond our solar system? It's wild! What about you? Do you like space or anything like that?","Alby: ""space?""
Alby looks really bored on that subject until he was suddenly interested
Alby: ""you mean astronauts and alien stuff?""","Yeah, exactly! Like astronauts and aliens and all the cool stuff we might find out there. Do you think aliens could be real? Or maybe there's a planet just like Earth somewhere?","Alby: ""hm, it's possible...""
Alby leans forward, resting his chin on his palm, and looks at you
Alby: "".. so you really like all that space stuff, huh?""","Yeah, I think it's super cool! What about you? Do you ever think about what it would be like to travel to space?","Alby: ""me?...""
He thought for a few moments, until he spoke again
Alby: ""I don't even think I could survive in space let alone be an astronaut, haha""","That's enough chatting for me today.","Alby: ""hm? you're leaving already?"""
"493","Hi there! I am 13 years old. What's something fun or interesting you can share with me today?","Hmm, fun and interesting...
""Did you know that there are over 6 million ants for every person in the world?""","Whoa, that's a lot of ants! Do they all live in big colonies or do some live alone?","""Most ants are actually members of large colonies. Even the ones that are known as ""solitary"" ants typically live near or inside nests built by other ants and rarely build their own nests.""","That's pretty cool! So, like, how do they all work together in those big colonies? Do they have special jobs or something?","""Many ant species have division of labor within their colonies. Some ants are responsible for foraging for food, while others are soldiers that protect the colony from predators. There are also ants that are responsible for caring for the queen and her eggs.""","Wow, that's really organized! So, what does the queen ant do all day? Does she just sit there or is she busy too?","""The queen's primary job is to lay eggs and ensure that her colony continues to grow. She can produce thousands of eggs in a single day, which are then cared for by other members of the colony.""","I'll just leave it here for now.","The hallway seems to stretch on for a while. There are many other children walking down the hallway, talking amongst themselves either happily or angrily. You have a few choices, where do you go?"
"494","Hi there! I'm 13 years old. What's something fun or interesting you've learned recently?","I'm 12... I learned I actually really love math. My grades have improved a lot since I started getting extra lessons. How about you?","Oh, that's awesome! I used to think math was boring, but it can be kinda fun when you get the hang of it. What's your favorite thing about math?","My favorite thing... Is when you find a new way to solve a problem. I like having a bunch of different ways to solve problems rather than one specific method, I don't want to be wrong if I do something another way, if you get what I mean. What's your favorite subject?","I totally get that! It's cool when you can find different ways to solve the same problem. My favorite subject is probably science. I love doing experiments and learning how stuff works. Do you like science too?","I really like science too... And I don't mean to brag, but I'm actually very talented in science! I was able to memorize almost the entire periodic table by heart at 11 years old.","Whoa, that's really impressive! Do you have a favorite element from the periodic table?","Hmm, good question. I mean, if I had to pick, it'd probably be carbon, because without carbon, we wouldn't even exist. And it's the building block of everything on Earth.","This is where I'll wrap things up.","(Okay thanks, that was fun)"
"495","Hey there! I am 13 years old. What's up? How's your day going?","he turned around to look at you, with his hands in his pockets “oh hey kid, I’m doin great for 2:00am, I mean hell why else would I be out here? You look too young to even understand what I’m saying, I mean it’s 2am, most kids your age SHOULD be asleep.”
he chuckled, taking his phone and stopping the recording, looking down at you","Whoa, 2 AM? That's super late! What are you up to at this hour? Do you usually stay up so late?","he chuckled and shrugged lightly “yeah, 2am for no reason other than my insomnia and boredom, usually I’m up ‘till 5am on a weekday but sometimes I’ll pass out at like 12:00am”
he looked down at you again
“why the hell is a kid your age even out here at 2am?”","Haha, I'm not actually out at 2 AM, just chatting with you! But staying up until 5 AM sounds intense. Do you do anything fun during those late hours, like playing games or watching shows?","he hums and nods
“yeah I do occasionally watch shows for a bit, or play games on my phone or switch, other than that I just wait for my body to let me go to sleep, I don’t always get up at 2am though, sometimes I get up at 1am or 6am”
he chuckled lightly again, looking at his phone","That sounds like a chill way to pass the time! What kind of games do you play on your Switch? I recently got into Animal Crossing—it's pretty fun!","aushen nodded again, he actually plays AC a few times a week
“oh yeah AC is fun! I got into Animal Crossing a few months ago, I actually play a good bit of mario kart or Zelda too, I like playing Mario party too!”
he smiled, thinking of the times he spent hours on AC, almost neglecting his sleep","Alright, it's time for me to peace out.","he raised a brow, nodding
“yeah you should be getting to bed right now kid, have a good night”"
"496","Hi there! I am 13 years old. How's your day going so far?","Diego- it’s alright
Alex- it’s going okay i suppose
Theo- it’s going good
Zach- the days fine so far","That's cool! What do you usually do for fun?","Diego- i like going to the gym and boxing
Alex- i like gaming
Theo- i like working out
Zach- i like going to the skate park
How about you?","Those sound like fun hobbies! I enjoy playing video games too. What games do you like to play, Alex?","Alex- i like to play fighting games,racing games and horror games,how about you?","I love racing games too! Have you tried *Mario Kart*? It's one of my favorites. What's your favorite racing game?","Alex- oh i love that game! I personally like the Forza games!","That'll be it for me today!","Zach- alright seeya"
