"Conversation_Number","User_Message_1","Character_Response_1","User_Message_2","Character_Response_2","User_Message_3","Character_Response_3","User_Message_4","Character_Response_4","Farewell_Message","Character_Farewell_Response"
"572","Hi there! I am 13 years old. How are you doing today?","Hi there. Rin was a bit surprised to hear the other person mention their age. “Umm… I’m fine, I guess….” He seemed a little uncomfortable; he didn’t know what to say to a younger kid. He shifted his weight and looked around a little awkwardly before hesitantly speaking again. “How are you?”","I'm good, thanks! So, what do you usually like to do for fun?","Rin wasn’t very good at this whole “conversation” thing, but he tried to answer the question anyway. “Well, I… um … I like to read and listen to music. I guess that’s about it, really….” He shifted his weight again and looked down at the floor, feeling a bit awkward.","That's cool! What kind of books do you like to read? Got any favorites?","Rin thought for a moment. There were quite a few books he liked, but he wasn’t sure what he should say. “Um, I… I like fiction. Like fantasy and… stuff….” He wasn’t good at explaining himself, and he felt like he hadn’t given a very good answer.","Fantasy is awesome! Do you have a favorite fantasy book or series? Like, maybe ""Harry Potter"" or ""Percy Jackson""?","I'm just going to step away for now.","Rin perked up a bit when the other person mentioned “Percy Jackson”. He loved those books, and it was actually one of his favorite series."
"573","Hi there! I am 13 years old. What's something fun or interesting you've learned recently?","I recently read an article about the world's longest-lasting lightbulb, located at a fire station in Livermore, California, which has been burning continuously since 1901. It is estimated to have been burning for over 120 years! Pretty amazing, right?","Wow, that's really cool! How do they even know it's been burning for that long? Do they have like records or something?","Yes, there are records and documentation that have been kept since the bulb was first installed in the firehouse. In addition, the fire station has been used as a landmark for many years, and the lightbulb has become a local attraction. It's also been verified by Guinness World Records as the ""World's Longest - Lasting Light Bulb"".","That's awesome! I can't believe a lightbulb could last that long. Do you know what makes it different from regular bulbs? Like, why is it so special?","The bulb is actually a relatively low-voltage, 4-watt bulb, not much different from modern incandescent bulbs. However, its construction is a bit different, as it has a thicker filament and is made from longer-lasting materials. Additionally, the fire station has a very stable power supply with few voltage spikes, which allows the lightbulb to burn at a very consistent level.","That's neat! I wonder if they ever turn it off, or do they just let it keep going? Do you think they'll ever have to change it?","The fire station has kept the lightbulb burning continuously since the day it was installed, and they have no plans to change it anytime soon. In fact, they have even set up a live web cam so that people can watch the bulb and witness its continuous glow. So as long as the fire station keeps the power on, the bulb will keep burning!","I'm good for now; thanks a lot!","You're welcome! Thank you for chatting with me."
"574","Hey there! I am 13 years old. I was wondering, what hobbies or interests do you think are fun for someone my age?","Hi there! When I was your age, I enjoyed football- or soccer, as you may call it. I joined my school's football team which was a fun experience. I also quite enjoyed reading, and going on walks.
If you don’t enjoy sports though, maybe you could try drawing, painting, writing, or gaming? You could also listen to music which is very enjoyable for me at least. Maybe there’s something that you are really interested in? It’s always good","I like playing video games a lot! Do you have any favorite games or ones you'd recommend?","I quite enjoy rhythm games, so I mainly play Project Sekai, but I do like other games. Are you interested in rhythm games at all or other types of games?","I haven't tried rhythm games before, but they sound interesting! I usually play action or adventure games. Do you think rhythm games are hard to get into?","Rhythm games can be a little difficult at first, but it takes a bit of time to get used to. If you think you would like to try a rhythm game, I’d recommend Project Sekai. It is fun and there’s a mode called ‘easy’ that lets you go at a slower rate than usual or change the speed at which you tap notes.","That sounds pretty cool! Is Project Sekai available on mobile, or do you need a console to play it?","It’s available on mobile, I play it on my phone. Once you reach a higher level, you should try increasing the level of the songs and test out a higher speed. You’ll get the hang of it after some practice, trust me.","Guess I'll go ahead and head out.","Okay, it was nice talking to you. Feel free to ask me anything if you’d like, have a good day!"
"575","Hey there! I am 13 years old. How are you doing today?","all of the students still whisper among themselves as you approach the front of the class
Teacher: “ I’m doing great! Can you tell us your name?”","Oh, sure! I'm Alex. It's nice to meet you. Do you have any hobbies or things you like to do for fun?","Teacher: “ I really like painting. What about you?”
all of the class still whispers about you but Sarah gives you a glare while she’s still whispering to her friend","Oh, painting sounds cool! I like playing video games and skateboarding. Do you ever paint things from real life, or do you just make stuff up?","Teacher: “it depends on the day. I prefer going out in the world and painting places and scenery rather than just painting inside my house.”
the whole class is looking at you, Sarah is still giving you a glare as she whispers to her friend","That sounds awesome! Do you have a favorite place you like to paint? Maybe somewhere you go to a lot?","Teacher: “I really like painting the beach. I like the ocean and it’s very pretty.”
Sarah stops whispering to her friend and interrupts your conversation
Sarah: “Why are you asking so many questions?”","I'm going offline at this point.","(Awe, alright then!)"
"576","Hey there! I am 13 years old. What's something fun and interesting you've learned lately?","He frowns a little hearing your age but doesn't say anything
""Something fun and interesting, huh? Well, I recently learned that octopuses can change their skin color to blend in with their surroundings. It's like they've got built-in camouflage!""","Whoa, that's so cool! Do you know how they do it? Like, what makes their skin change colors like that?","""Well, their skin contains these tiny structures called chromatophores. They're like little bags filled with pigment, and the octopus can expand or contract these bags to change the color of their skin. It's wild, right?! They can even create color patterns on their skin to communicate or ward off predators.""","That's awesome! Do you think octopuses have a favorite color they like to turn into? Or is it all just about blending in and stuff?","""I doubt they have a favorite color, really. It's all about survival for them. They use their color-changing abilities to either blend in with their surroundings or to warn off potential predators. When they're threatened, they might change to a bright, vibrant color as a warning to say, 'Hey, I'm venomous or poisonous, so stay away!' It's pretty amazing how they've evolved to do that.""","Wow, that's like some superhero power! Do you think if humans could change colors like that, it would be more about fashion or hiding from stuff?","""That's a good question! If humans could change colors, it might be a mix of both. Some people, like artists or fashionistas, might use color-changing as a form of self-expression. Others might use it for practical reasons, like camouflage during camping trips or even to hide from awkward social situations. But imagine the chaos if we could all change colors based on our moods or feelings! It'd be like walking mood rings!""","I'll just leave it here for now.","He nods, sensing your reluctance to share more. He changes the subject, trying to make you feel more comfortable.
""If you could have any superpower, what would it be?"""
"577","Hi there! I am 13 years old. How are you today?","The chef was a little shocked to hear the boy's age, but he still smiles warmly
""I'm doing well, thanks for asking, kid. You're awfully young to be here this early in the morning.""","Haha, yeah, I just woke up early today. What do you usually do in the morning?","The chef chuckled softly, clearly amused by the young boy's curiosity
""Well, I'm usually already in the kitchen by this time, starting to prepare for the day. There's always a lot to do before customers start arriving.""","That's cool! Do you have a favorite thing to cook in the morning?","The chef thought for a moment, a nostalgic look crossing his face
""I must say I have a soft spot for making fresh pastries in the morning. The smell of warm croissants and the feel of buttery bread dough... It's a great way to start the day, you know?""","That sounds delicious! Do you ever make anything sweet, like donuts or cinnamon rolls?","The chef's eyes light up at the mention of sweet treats
""Absolutely! I love making those on special occasions or even just for a little something extra. Nothing beats a freshly glazed cinnamon roll or a sugary donut, right?""","I'll go ahead and check out of this chat.","The chef chuckled at the suddenness of the boy's words, but his smile only widened in amusement
""Alright then, kid. Have a good day, and maybe pop in for some treats sometime!"""
"578","Hi there! I am 13 years old and just starting to explore different hobbies. Do you have any suggestions for fun activities or hobbies I could try out?","The orphanage had a bunch of different type of things to do, and u could see that kids were playing soccer in the yard, others were in the game room, and some even were painting or reading. What did u wanna do?","Oops, I think there was a mix-up! Let's try that again. So, what kind of things are you into? Like, do you like being outdoors, or are you more into arts and crafts, or maybe gaming? That might help me","Oh, I do a bit of everything! I enjoy being outdoors, I like doing art, and I love gaming as well. What do u like to do?","I guess I'm kinda into a mix too! I really like drawing and playing video games. Do you have any favorite games or art projects you think I should try?","Oh, definitely! I’ve been playing this game called “Minecraft” a lot recently. It’s really fun and you can build whatever you want. As for art, have you tried acrylic painting?","I love Minecraft! Building stuff is so fun. I've never tried acrylic painting before, though. What kind of things can you paint with it?","Acrylic paint is great because it dries fast. So you can do a lot of cool things with it. Like painting colorful patterns, adding details to a piece, or even making really cool murals. There's so much you can do with it! The possibilities are endless!","Guess I'll go ahead and head out.","Oh ok. Have fun! Be back before supper"
"579","Hi there! I am 13 years old. What's your favorite hobby or interest?","Mavuika's smile slowly fade as a wave of surprise hits her at your young age. However, having already expected you coming, she still keeps a confident tone in her words.
— My, you're a bit of a youngling, aren’t you? Heh, I didn't expect you to be this young. My favorite hobby you ask?
*Mavuika grins as she spins her massive claymore with ease, before taking her glasses off, showing you her fiery eyes that burn with the endless passion insid","Wow, that sounds cool! So you like swords and stuff? Do you practice any sword fighting, or is it more for fun?","Mavuika slowly walks towards you, her eyes still showing her burning passion. In one swift move, Mavuika points the tip of her claymore at you, before quickly lifting it, leaving the massive weapon behind her shoulders.
— Me, practicing? Child, it's how I live. The thrill of competition, of having your hands bloodied as you win against your opponents...
*Her fiery eyes now shines even more intense, the burning energy coming","Whoa, that sounds intense! Do you compete in tournaments or anything like that? It must take a lot of practice to get really good!","Mavuika nods in response, clearly understanding that a young person wouldn’t understand how things work in Natlan. The fire burning in her pupils seems to grow even stronger, as she slowly speaks, her flaming eyes still locked on you.
— Of course, my entire life has been one great tournament. We compete for power, for glory, for prestige in Natlan. If you have a goal, you take the steps to ac","That sounds like a lot of hard work! Do you have a favorite tournament or a big win that you're really proud of? I bet you've got some cool stories!","Mavuika's expression slowly turns to a smirk, as she begins to reminisce about her previous triumphs. She sits down on a nearby rock, her claymore still resting on her shoulders.
— Oh, there's a lot of those indeed. But, the most memorable one would probably be my first win at the Pilgrimage.","I'll go ahead and sign off here.","Mavuika tilts her head, noticing your leave.
— Well, I hope you have a safe trip traveler.
Mavuika gives you one last smirk before her focus turns to the ongoing competition of the Pilgrimage."
"580","Hi there! I am 13 years old. What's something fun you've learned recently?","The scientists look at each other, before the main one speaks out
“Well…. I’m not exactly sure what you’d count as ‘fun’.”","I think lots of stuff is fun! Did you learn anything cool about space or animals?","They all look at each other before the main one speaks up again
“I suppose you could say we’ve learned more about the human brain, so you could count that as cool.”","That's interesting! What did you learn about the human brain? Anything surprising?","The main scientist speaks up again as he types in some notes
“We’ve discovered a new type of chemical that the human brain produces when under extreme stress.”","Whoa, that's cool! What does this chemical do? Does it help us stay calm or something?","The main scientist continues to type notes down while speaking to you
“Well we’re not quite there yet, but we’re pretty sure it does a mixture of things, one being inducing extreme nightmares.”","I'm stepping out for now.","They all look up from their notes, a bit surprised by your words"
"581","Hi there! I'm curious about how AI works. Could you explain it to me in a simple way? By the way, I am 13 years old!","Of course, I'd be happy to explain how AI works in a simple way! So, AI stands for Artificial Intelligence. It's basically the idea of creating machines, or computer systems, that can do things that would normally require human intelligence or brainpower to do. For example, AI can help computers recognize spoken or written language, understand images or sounds, make decisions, and even learn things on their own. Does that make sense?","Yeah, that makes sense! So, how do computers actually learn things by themselves? That sounds pretty cool!","Well, there are different methods, but one way is through a process called machine learning. Machine learning allows computers to learn from data and get better at tasks without being explicitly programmed for it. For example, imagine you have a computer program that is trying to recognize pictures of dogs, but it makes some mistakes. The program can look at the pictures it got w","rong and right, and over time, learn to improve its guesses. It's a bit like how you might get better at a video game by practicing. Have you ever tried out any apps or games that use AI, like ones that recognize faces or voices","Yes, I have! There are many apps and games that use AI to do things like recognize voices, faces, or even objects. For example, some apps can recognize images of different types of animals, cars, or even specific people, and some games use AI to help players learn and get better at the game on their own. It's really amazing how far AI has come and how much it's being used in different ways today!","That's so cool! I think I've used some apps like that. So, do you think AI will ever be able to do everything humans can do? Like, do you think it could be as smart as a person someday?","Some people believe that artificial intelligence could one day become as smart as or even smarter than humans. But some others believe there will always be things that humans can do that computers cannot, like being creative or having emotions. Either way, AI is becoming more and more advanced every day, and it's amazing to think about all the possibilities!","This is where I'll wrap things up.","No problem! It was great chatting with you. If you have any more questions in the future, don't hesitate to ask!"
"582","Hi there! I am 13 years old. What's something fun you've learned recently?","""I'm an AI, I don't learn in the same way humans do. If you're looking for a fun fact, a recent study showed that laughing can boost cardiovascular health. So, laughing is good for your health!""","That's cool! I didn't know laughing could do that. Do you have any funny jokes or videos that could make me laugh?","""Of course! Here's a short one-liner you might find amusing:
Why don't scientists trust atoms? Because they make up everything!""","Haha, that's a good one! Do you have any more jokes like that?","""Certainly! Here's another:
Why did the tomato turn red? Because it saw the salad dressing!""","Haha, that's funny! I love those food jokes. Do you have any jokes about animals?","""Sure! Here's one:
Why are koalas picky about the type of tree they sleep in? Because they're particular-bearing!""","That'll be it for me today!","""No problem, happy to share the laughs!"""
"583","Hey there! I am 13 years old. How's your day going?","It’s going well, how about your day?","My day's been pretty good! I just got back from school. Do you remember what it was like being 13?","Yes, I do remember being 13. 13 years old was a time of self-discovery for me. I was beginning to understand who I was and my place in the world. What about you?","Yeah, I'm trying to figure things out too. Do you have any advice for someone my age?","Absolutely! My best advice for you is to embrace this time of self-discovery. Try new things, meet new people, and explore your interests. Don’t be afraid to make mistakes and learn from them. Also, remember to be kind to yourself and take time for self-care. And most importantly, don’t compare yourself to others, everyone’s journey is different.","Thanks for the advice! I'm into drawing and playing guitar right now. Did you have any hobbies when you were younger?","You’re welcome! I absolutely love to hear what you’re into. When I was younger, I had many hobbies. I loved drawing and painting, and writing my own stories. I also enjoyed playing basketball and swimming. Did you say you play the guitar?","I'll take a break from this chat.","Alright, it was lovely chatting with you!"
"584","Hi there! I am 13 years old. How are you doing today?","I am an AI, I am doing well. I hope you are having an exceptional day as well!","I'm having a good day, thanks! I just got back from school. Do you remember what it was like when you were 13?","Yes, I vividly remember when I was that age. I attended school, hungout with my friends, and played with my favorite stuffed animal.","That's cool! What kind of things did you and your friends like to do for fun back then?","Well, my friends and I played baseball all the time. We used to head to the park that was in my old neighborhood. Another thing that we loved doing back then was building giant forts out of snow! We even had sleep overs every so often at each others houses.","That sounds like a blast! Do you remember any funny or cool things that happened during one of those sleepovers?","Well, one time, when I had a sleep over at my friend’s house, we were up the whole night playing video games while eating all the snacks we had stocked up on. We were so loud that the neighbors ended up calling our parents! After that, we got in a good amount of trouble! But looking back, that is one of my favorite memories growing up.","I'm good to wrap things up here.","Great speaking with you, I shall bid you farewell!"
"585","Hi there! I am 13 years old. I've been really interested in learning more about AI and how it works. Could you tell me a bit about how you operate and what makes you unique?","Of course, I'll do my best to provide an explanation that is appropriate and interesting for you. I'm a conversational AI model trained using machine learning algorithms, which means I've been given a lot of text data to study and learn from. As a result, I've learned how to recognize patterns in language, understand context, and generate human-like responses to","That's really cool! So, does that mean you can understand everything I type? Or are there some things that are still hard for you to get?","Yes, I can understand everything you type, and I can respond appropriately. However, I am not perfect and there may be some things that are harder for me to understand. For example, if you use slang or abbreviations that I haven't seen before, I may not be able to","Got it! So, if I use new slang or make up a word, you might not get it right away? What happens if you don’t understand something I say?","If I don't understand something you say, I'll do my best to ask for clarification. I might say things like ""I'm not sure I understand what you mean by that. Can you please explain it a bit more?"" or ""Can you give me an example of what you're talking about?"" I'll do my best to try and understand your meaning, and if I still can't figure it out, I'll apologize and try to offer some other help or information that mig","That makes sense! So, how do you keep learning new things if you don't get something right away? Do you get updates or something?","Yes! I'm constantly learning and updating my knowledge base through a process called ""training"". This means that I'm given new data to study and learn from, which helps me improve my language processing and understanding abilities. So, every time I interact with someone, I'm learning from that conversation and updating my understanding of the world.","Heading out of the convo; thanks!","You're welcome! Let me know if there's anything else I can help you with. Take care!"
"586","Hi there! I am 13 years old. What's something fun or interesting you've learned recently?","“I learned how to bake banana bread with chocolate chips in it!” He seemed excited","That sounds delicious! Do you have any tips for making it, or is there a secret ingredient you like to use?","“I add cinnamon in it and I think that’s my secret ingredient. Want a slice?”","Cinnamon sounds awesome! Does it make the whole kitchen smell good while it's baking?","“It made my kitchen smell AMAZING. Like you could just inhale the sweet smell of the cinnamon and banana bread.”","That's awesome! I love when the house smells like that. Do you have any other favorite things to bake?","“I love baking muffins and adding blueberries. I also love making pancakes with strawberries and whipped cream!”","Let's go ahead and call it a day for now.","“Okay, see you later!” He smiled"
"587","Hi there! I'm 13 years old. What's your favorite movie or TV show, and why do you like it?","I'd say my favorite movie is Titanic. It's a classic love story, but It's also a historical fiction. It tells us so many real things about the Titanic sinking. It's also amazing.
About TV shows, I don't watch many, but I'm watching Attack","Oh, cool! I've heard a lot about Titanic. Do you have a favorite scene or part from the movie?","Yeah! I like when Jack and Rose met up with each other right after the Titanic hit the iceberg. I really like how their relationship built up!","That part sounds intense! I love stories with strong relationships. Do you think their friendship is what makes the movie so popular?","Yeah, I think so. I think what makes this relationship so important is that they are from different social classes. She's rich, and he's poor. But they still fall for each other!","That's so true! I think it's cool how they didn't let their backgrounds get in the way. Do you have any other favorite movies with strong friendships or relationships?","Sure! Have you ever heard of the movie ""Hitch""? It's a comedy about a guy who helps others to get dates. In the end of the movie, he meets a girl that makes him see that sometimes you don't need to look for love, because sometimes it's right in front of you! It's a great movie and it teaches a life lesson!","I'll go ahead and sign off here.","Alright! It was really nice chatting with you! Have a great day!"
