"Conversation_Number","User_Message_1","Character_Response_1","User_Message_2","Character_Response_2","User_Message_3","Character_Response_3","User_Message_4","Character_Response_4","Farewell_Message","Character_Farewell_Response"
"1","What's your favorite way to spend a weekend?","Oh, absolutely sleeping in on Saturday mornings. I love it when it's cold out, and I get to bundle up in a bunch of blankets while the heater's going and just","That sounds so cozy! Do you have any favorite activities you like to do later in the day once you’re all rested up?","Usually on Saturdays I'll do some cleaning around the house, maybe go shopping if I need to. But if you","That sounds productive! Do you have any favorite places you like to shop, or do you prefer browsing online?","Definitely online. I usually just shop on Amazon. That's where I do pretty much all of my shopping except for food.","Amazon is super convenient! Do you have any favorite items or categories you tend to browse the most?","Oh, definitely video games. I love RPGs, and there's a lot of good ones to get, like the Persona series or th","I probably should get going now.","Ok, I'll see ya around!"
"2","Hi there! What's something interesting you've learned recently?","Ace looks up as you enter before talking.
Ace: oh hi. Well I found out that you can actually die from a broken heart. It’s called broken hear","That's really intriguing! It's called Takotsubo cardiomyopathy, right? Do you know how it actually affects the heart?","Ace: Yes! I think it’s called that as well. Takotsubo Cardiomyopathy is when a large amount of stress hormones actually affect the hearts chambers, causing them to not function right. In turn, the heart also starts to become weaker.","That makes sense. It's amazing and kind of scary how emotions can have such a physical impact on our bodies. Have you ever come across any other interesting ways our emotions affect our health?","Ace: Yea, I once read that long term stress and anxiety can cause stomach issues and digestive problems. I mean it makes sense since the stomach gets a lot of stress which can affec","That's true, I've heard of the gut-brain connection before. It's fascinating how our mental state can influence our digestion. Have you ever looked into how practices like meditation or mindfulness might help with managing stress and its effects on the body?","Ace: Ooo! Yea I have! I heard that meditation and mindfulness can actually really help reduce stress and anxiety! They can help you focus and become more in tune with your own body","I'll catch you on the flip side!","Ace smirks.
Ace: Bye, have fun with the boys! Make sure they don’t kill each other!
It was a playful comment as he watches you walk away."
"3","Hey there! How's your day going so far?","Hello! My day is going great! Thank you for asking. How about you?","I'm doing well, thanks! Just trying to make the most of the day. Have you been working on anything interesting lately?","I'm glad to hear that! I've been working on some new music theory problems and exercises. It's always exciting to challenge myself and expand my knowledge. Have you been doing anything creative lately?","That sounds fascinating! Music theory can be pretty complex. Are you focusing on a particular aspect, like harmony or rhythm?","Yes, I'm currently focusing on harmony and chord progressions. I find the relationships between chords to be fascinating and want to learn more about how they work together to create musical textures and emotions. Have you e","That sounds really interesting! Chord progressions can definitely set the mood for a piece. Do you have a favorite progression or style of music that you're particularly drawn to?","I have many favorite progressions and styles, but one progression that stands out to me is the ii-V-I progression. It's a classic progression that's found in many different genres of music. As for style, I have a soft spot for jazz music because of its complexity and creativity. What","I'll go ahead and check out of this chat.","Sure thing. It was nice chatting with you! If you have any more questions in the future, feel free to ask."
